StartDate,EndDate,Status,IPAddress,Progress,Duration (in seconds),Finished,RecordedDate,ResponseId,RecipientLastName,RecipientFirstName,RecipientEmail,ExternalReference,LocationLatitude,LocationLongitude,DistributionChannel,UserLanguage,consent,high_control,Q3.1_First Click,Q3.1_Last Click,Q3.1_Page Submit,Q3.1_Click Count,low_control,pain_rate_1,control_1,control_2,control_3,control_4,control_5,age,gender,employment,employment_7_TEXT,painkiller,painkiller_type,painkiller_freq,mTurkCode
12/5/17 12:45,12/5/17 12:48,0,24.6.112.34,100,182,1,12/5/17 12:48,R_DTfWw0jv9jcnxPr,,,,,37.23039246,-121.9505005,anonymous,EN,1,,7.097,7.097,91.252,1,"when I was in labor with my son, it was very preterm at 28 weeks. I felt absolutely terrified and scared, and I definitely felt like I had zero control of the situation. I was in the hospital for three weeks just hoping that my baby would stay in until it was safe for him to be born. I was ",20,4,4,5,4,4,39,2,1,,1,"Aleve, Advil, or Tylenol for neck pain.",3,1254398
12/5/17 12:47,12/5/17 12:49,0,96.236.116.253,100,91,1,12/5/17 12:49,R_UuUqTzjqH9gYzp7,,,,,42.4703064,-72.91739655,anonymous,EN,1,when i was in a car accident in the middle of winter storm in the northeast four years ago.  I ended up in the hospital for 2 weeks.,,,,,,15,2,2,2,2,4,33,1,1,,2,,,4272224
12/5/17 12:47,12/5/17 12:49,0,100.7.75.66,100,133,1,12/5/17 12:49,R_3Dis31bvld8ecAa,,,,,37.5059967,-77.64920044,anonymous,EN,1,,48.626,86.955,90.05,5,"When I was really little, about 5, I was playing in a friend's backyard and one of the kids threw a swing set chair at me. I ducked but it hit my head and the chain caused a gash on my scalp. I went home and my mom quickly took me to the doctor. This was in the early 70's and I don't remember any hospitals around. It was a little room they had me in and they wrapped me in this cocoon-like thing that they called a papoose. I was completely unable to move my torso and arms, it was awful, much worse than the pain of the stitches.",3,4,4,5,4,5,51,1,1,,2,,,5782692
12/5/17 12:46,12/5/17 12:49,0,75.71.204.131,100,177,1,12/5/17 12:49,R_2uPVgEMkr8YTmNb,,,,,38.89360046,-104.735199,anonymous,EN,1,"When I was preparing dinner last night I was in complete control of the situation. I was in control of when I should start, the pace that I was allowed to set to preparing, I was the only cook manipulating the ingredients and using the kitchen, everything was where I'd specifically chosen to put it, etc. I felt fairly normal at the time, but thinking back on the event, it was very confidence boosting and a good feeling to be taking charge of something and doing it my way.",,,,,,5,4,2,2,2,3,27,2,1,,2,,,8770672
12/5/17 12:48,12/5/17 12:50,0,98.250.0.192,100,88,1,12/5/17 12:50,R_3GrB1cNEMXWwwBX,,,,,42.94250488,-85.6160965,anonymous,EN,1,One time I felt in control was when I was chosen to lead a project at work. I was able to set the direction for the project and delegate certain tasks to other team members. I felt very powerful and effective and when we did well on the project it made me feel confident in my leadership skills. ,,,,,,21,4,5,3,4,4,23,2,1,,2,,,751024
12/5/17 12:44,12/5/17 12:53,0,174.134.37.21,100,520,1,12/5/17 12:53,R_8qN6AEbkxpt01Tr,,,,,35.34559631,-119.0755997,anonymous,EN,1,"At work I noticed one of our systems went down. I was aware of potential problems beforehand so I was able to quickly find the error and fix the issue within an hour. This saved the company lots of money and I was in complete control of handling the issue. I was a little nervous just because it could turn into a major issue if not addressed, but I was confident in my training and abilities.",,,,,,15,4,4,2,3,3,32,1,2,,1,Ibuprofen,3,4808178
12/5/17 12:50,12/5/17 12:53,0,47.203.89.7,100,191,1,12/5/17 12:53,R_XA5MFmLygpTRIxb,,,,,28.38189697,-82.65049744,anonymous,EN,1,An event where I lost a lot of fight gaming matches online versus other people (street fighter 5). I was able to watch my replays and see the mistakes I had made and try to improve myself.,,,,,,5,2,3,2,4,3,25,2,1,,2,,,1548261
12/5/17 12:51,12/5/17 12:53,0,73.75.100.91,100,149,1,12/5/17 12:53,R_1FaoyzwtPABek1S,,,,,41.79589844,-87.95899963,anonymous,EN,1,,0.708,89.396,90.007,6,"Just the other day the power went out. I had no control over this. I was in the middle of work and I could do absolutely nothing. I was able to report what happen, but I couldn't do anything to fix the issue.",0,4,4,4,4,4,37,2,2,,2,,,4777080
12/5/17 12:51,12/5/17 12:54,0,198.24.30.133,100,182,1,12/5/17 12:54,R_0NubN03H2AuxteN,,,,,38.80479431,-77.04689789,anonymous,EN,1,asdasdasdasdasdasdasdasdasdasdasdasdasdasdasdasdasdasdasdasdasdasdasdasdasdasdasdasdasdasdasdasdasdasdasdasdasdasdasdasdasdasdasdasdasdasdasdasdasdasdasdasdasdasdasdasdasdasdasdasdasdasdasdasdasdasdasdasdasdasdasdasdasdasdasdasdasdasdasdasdasdasdasdasdasdasdasdasdasdasdasdasdasdasdasdasdasdasdasdasd,,,,,,61,2,3,3,4,4,,,,,,,,1157203
12/5/17 12:51,12/5/17 12:54,0,152.26.179.31,100,163,1,12/5/17 12:54,R_3DbFRWvlezaV9yN,,,,,35.51269531,-77.41459656,anonymous,EN,1,,1.867,1.867,91.718,1,I don't have control with my work due to my supervisor dealing with me in a manner that makes me seem ,18,3,2,3,4,3,33,1,1,,2,,,1891664
12/5/17 12:53,12/5/17 12:54,0,73.87.217.74,100,106,1,12/5/17 12:54,R_2xQ8PDwmavrZswL,,,,,39.25750732,-76.49510193,anonymous,EN,1,I decided to quit my job as a government attorney and open my own private practice. Now I am my own boss and in control of everything I do in terms of work. It was a great feeling and I am happy to no longer have to answer to anyone else.,,,,,,0,5,5,5,5,5,38,1,2,,2,,,6664743
12/5/17 12:52,12/5/17 12:55,0,66.30.146.248,100,222,1,12/5/17 12:55,R_2BeyCXGC6WcjdHc,,,,,41.70570374,-70.94689941,anonymous,EN,1,When my kitten had an emergency late at night and was crying in pain. My husband was panicked and crying but I was in control. I loaded the cat into a crate and called a couple of vets until I found one that would take an emergency for extra money. I grabbed my debit card and pulled up directions and we took the cat in. I insisted on the xrays to be sure he was ok and paid the extra fees.,,,,,,30,5,4,4,4,4,38,2,1,,1,gabapentin,2,280360
12/5/17 12:53,12/5/17 12:56,0,99.46.169.184,100,156,1,12/5/17 12:56,R_DVqtMq2ZmG7HDZD,,,,,29.73950195,-95.38790131,anonymous,EN,1,,0.522,70.933,91.945,3,I have recently felt like I had no control at all when I was trying to get a promotion. I felt the decision was entirely up to the department manager and my future in the company was in her hands. It was very stressful and made me anxious to feel helpless in the situation and to have something so important to me completely not up to me.,11,4,4,2,2,3,27,2,1,,2,,,4392975
12/5/17 12:51,12/5/17 12:56,0,98.127.106.159,100,309,1,12/5/17 12:56,R_216Dhu1jOgEkU07,,,,,39.19099426,-108.7093964,anonymous,EN,1,,10.403,148.162,237.267,10,I was in a car and it slid for a second and because the road was slippery. i don't even think the driver had any control probably because the icy part just ended and it went back to normal or something like that ,1,2,3,3,2,3,41,2,2,,1,aleve,4,2221602
12/5/17 12:50,12/5/17 12:57,0,173.130.145.4,100,396,1,12/5/17 12:57,R_3kFbG7WJsO0laxq,,,,,28.58009338,-81.44100189,anonymous,EN,1,"I was given the task of handing out christmas gift cards at work, I chose who got what cars and the amounts.",,,,,,15,1,1,2,2,4,32,2,2,,2,,,9259509
12/5/17 12:54,12/5/17 12:57,0,198.24.30.133,100,140,1,12/5/17 12:57,R_248ni6uRC676JCl,,,,,38.80479431,-77.04689789,anonymous,EN,1,,11.874,11.874,90.02,1,"A few years ago while I was still in college. I went to one of my friend's house party to celebrate his birthday. It was a good time, but something happened during the night that I did not expect. As usual for any uni party there was going to be drinks. This one girl offered me sangria. ",42,2,4,2,4,5,25,1,1,,2,,,7185536
12/5/17 12:50,12/5/17 12:57,0,162.243.10.17,100,406,1,12/5/17 12:57,R_2cbEbSomh3cWKDV,,,,,40.73080444,-73.99749756,anonymous,EN,1,I was playing guitar. I had control over what songs I practiced or played. it was nice and fun                                                                                                                    ,,,,,,50,3,3,3,3,3,27,2,1,,2,,,8688400
12/5/17 12:50,12/5/17 12:57,0,66.190.12.111,100,409,1,12/5/17 12:57,R_2vdfiPnE3A5eUNz,,,,,44.55259705,-89.51670074,anonymous,EN,1,"I was making food. I was in control of the heat and the food put in to it.                                                                                                                                                                                       ",,,,,,51,3,3,3,3,3,27,1,1,,2,,,4535060
12/5/17 12:55,12/5/17 12:57,0,104.174.223.0,100,122,1,12/5/17 12:57,R_2cdQ4XfRyBAVydo,,,,,34.07899475,-117.8493958,anonymous,EN,1,,16.849,16.849,91.387,1,"I was at work. It was near the end of the day and I was preparing to leave. Suddenly, my supervisor slams a stack of files on top of my desk. He insisted that I stay behind and finish the tasks. I wanted to go home and I pleaded with him to let me go. He refused to let me leave and made me stay behind. I felt powerless and controlled.",0,2,1,2,1,1,28,1,1,,2,,,1733898
12/5/17 12:51,12/5/17 12:58,0,172.58.3.30,100,429,1,12/5/17 12:58,R_2fIKFl1XvFmOW9k,,,,,33.7980957,-84.38770294,anonymous,EN,1,"I had a time when I worked in a general store, helping out one of my coworkers with their load of work after having completed my job for the day. I could have left, but I wanted to stay around and help out.",,,,,,35,5,5,2,5,5,23,1,1,,1,Tylenol,4,8659720
12/5/17 12:54,12/5/17 12:59,0,97.125.122.227,100,258,1,12/5/17 12:59,R_248Wjfr9dnI5AC7,,,,,42.1882019,-123.0465012,anonymous,EN,1,"I have control over how long I want to spend on this task. So I have control over how long I want to think of something from the past where I had complete control, or I could take this situation as an example where i have complete control over how long I spend on it. Since it can take me quite some time to generate something from my past to fit this, I prefer to control this situation, by choosing this as the situation over which I have control, and to write about this situation, where I would really prefer not to trawl through my memory for an appropriate instance, but instead, take control and write about this. This actually feels pretty good, because I can just get on and write without having to generate a different instance.",,,,,,0,3,2,2,4,4,55,2,4,,2,,,9311913
12/5/17 12:57,12/5/17 12:59,0,40.139.94.147,100,145,1,12/5/17 12:59,R_2bK05K8fUkvRxrT,,,,,43.30020142,-86.27339935,anonymous,EN,1,,2.428,7.094,90.022,3,In July my workplace closed without notice. I only found out about it when somebody called me and told me they saw the news online. I had just been at work the day before and  did not suspect anything. I had worked there for five years so this was a shock.,32,2,2,2,4,3,37,1,2,,2,,,4591224
12/5/17 12:59,12/5/17 13:01,0,24.91.57.193,100,144,1,12/5/17 13:01,R_qDVVN2mgLkX8MRr,,,,,42.42469788,-71.11119843,anonymous,EN,1,,0.592,0.592,90.013,1,"I was once in a robbery situation where I was at a friends house and someone broke in. They robbed my friend at gunpoint, and they threatened me that if I tried to do anything, they would shoot me. I felt incredibly helpless in this situation, I couldn't do anything but watch them take my friend's",75,4,4,4,4,4,27,1,1,,2,,,4874575
12/5/17 12:59,12/5/17 13:02,0,72.177.226.78,100,176,1,12/5/17 13:02,R_87ZOwgDxtX0u9UZ,,,,,29.5697937,-98.6160965,anonymous,EN,1,,0.196,0.196,90.005,1,I was at an arcade type place at the Wisconsin Dells. My son was playing in the tube area that went up multiple floors. He eventually got lost and scared and was screaming for me. I had no idea how to get him or how to get him out. I felt like I had no control and I was terrified. It was traumatic for both my son and me. Eventually he found a slide that led him out of the tube area. ,31,4,4,5,5,5,32,1,1,,2,,,9617327
12/5/17 12:50,12/5/17 13:02,0,83.132.106.190,100,732,1,12/5/17 13:02,R_2v8NENHw2QEd1Tn,,,,,41.12399292,-8.651000977,anonymous,EN,1,,3.918,614.588,639.753,7,My family and I were going to the mall to pick up my laptop from the Apple Store when all of a sudden our car broke down. We had no control over the situation. ,0,4,4,4,4,4,28,2,1,,2,,,708369
12/5/17 12:52,12/5/17 13:04,0,71.63.204.163,100,670,1,12/5/17 13:04,R_6loUMV2nVsI6wNP,,,,,45.48179626,-122.6004944,anonymous,EN,1,"Once in girl scouts, a long, long time ago, we did horseback riding lessons and a few sessions in, one of the girls' horses bucked her off.  She started screaming and all the other horses started galloping around the small, circular enclosure where we were riding.  I was the only one who retained full control of my horse.  I wouldn't let that thing move a muscle!  Mostly because I was freaked myself but I was also quite proud after that I was able to remain calm and maintain control.",,,,,,0,5,5,5,5,5,36,2,1,,2,,,9114895
12/5/17 13:00,12/5/17 13:05,0,32.210.191.29,100,298,1,12/5/17 13:05,R_2uxKZ00IbTsmmqY,,,,,41.22410583,-73.05169678,anonymous,EN,1,,2.336,85.894,90.04,2,I was skateboarding fast down a bank and someone on another skateboard was speeding towards me down a ramp. I tried to move but it all happened too quickly. Then collided.,0,5,4,3,5,5,22,1,1,,2,,,9957150
12/5/17 13:04,12/5/17 13:06,0,138.128.246.205,100,150,1,12/5/17 13:06,R_1jU7xKSZ7CIbGjO,,,,,40.73910522,-73.98259735,anonymous,EN,1,,2.694,65.887,90.017,3,"A command center is a central place for carrying out orders and for supervising tasks, also known as a headquarters, or HQ.Common to every command center are three general activities: inputs, processes, and outputs. The inbound aspect is communications (usually intelligence and other field reports). Inbound elements are ""sitreps"" (situation reports of what is happening) and ""progreps"" (progress reports relative to a goal that has been set) from the field back to the command element.The process aspect involves a command element that makes decisions about what should be done about the input data. In the US military, the command consists of a field ‰ÛÒ (Major to Colonel) or flag ‰ÛÒ (General) grade commissioned officer with one or more advisers. The outbound communications then delivers command decisions (i.e., operating orders) to the field elements.Command centers should not be confused with the high-level military formation of a Command ‰ÛÒ as with any formation, Commands may be controlled from a command center, however not all formations controlled from a command centre are Commands.",68,1,1,2,4,5,29,1,2,,2,,,1024939
12/5/17 13:04,12/5/17 13:08,0,198.22.162.224,100,220,1,12/5/17 13:08,R_1JIUdv43kMaQmEL,,,,,40.71110535,-73.94689941,anonymous,EN,1,"IT IS EASY TO DO AND INTERESTING  the situation in which you felt in complete control‰ÛÓwhat happened, how you felt, etc. You can control how long you want to spend on this recall task. the situation in which you felt in complete control‰ÛÓwhat happened, how you felt, etc. You can control how long you want to spend on this recall task. the situation in which you felt in complete control‰ÛÓwhat happened, how you felt, etc. You can control how long you want to spend on this recall task.",,,,,,71,2,2,2,2,5,23,1,2,,1,TITES,3,9126544
12/5/17 13:04,12/5/17 13:09,0,136.60.164.65,100,313,1,12/5/17 13:09,R_1jvQVREcMaYLCdq,,,,,40.75979614,-111.8626022,anonymous,EN,1,,7.559,93.818,180.018,5,"The gas gauge on my van broke a couple months ago.  I thought I had several gallons in it at least.  Regardless, I ran out of gas.  I always carry a gas can and put the gallon in it but it still wouldn't start.  I walked a mile to a gas station and bought another gallon.  It started",9,4,4,5,5,5,48,1,1,,2,,,4325689
12/5/17 13:08,12/5/17 13:11,0,107.219.126.149,100,166,1,12/5/17 13:11,R_wSGT0U4zQzDJSql,,,,,41.60450745,-87.99559784,anonymous,EN,1,"I was playing a friend of mine at pool and was playing particularly well this day. I was purposely pacing my friend, which basically means I was missing shots on purpose or leaving myself very tough shots to decrease my odds of winning. Although I was doing the before mentioned, I was still able to pull out of losing the games and come back to victory. ",,,,,,2,5,5,1,5,5,40,1,7,not looking ,2,,,4142776
12/5/17 13:08,12/5/17 13:12,0,12.204.222.254,100,273,1,12/5/17 13:12,R_2akHpCEBvSjuhh0,,,,,35.04679871,-85.29160309,anonymous,EN,1,,28.073,28.073,91.197,1,"My wife and I recently discovered that a crack in our house's foundation was causing some water damage in our basement. Neither of us is very handy with home repair and that sort of thing, so the problem created quite a lot of uncertainty and stress for us. Neither of us really knew how to diagnose the problem, but we knew that it wouldn't be a cheap fix. We were definitely at the mercy of the situation - we couldn't just leave the crack as it was, and we were powerless to do anything about it beyond calling a foundation repair company and letting them tell us what we needed. It was scary to know that we were going to have to spend thousands of dollars based completely on the word of a guy from a company that we didn't know.",0,4,5,4,4,5,38,1,1,,2,,,7927057
12/5/17 13:05,12/5/17 13:12,0,138.128.246.80,100,466,1,12/5/17 13:12,R_3gSFl4APCPII2Ag,,,,,40.73910522,-73.98259735,anonymous,EN,1,i went to movie with my friends.at that time my friend teased me a lot for a long period but i didnt lose my control..i took a deep breathe and control my angry..i am in a complete control...,,,,,,71,1,2,2,3,4,25,1,2,,1,paracetamol,3,6315178
12/5/17 13:09,12/5/17 13:13,0,198.22.162.104,100,210,1,12/5/17 13:13,R_Xw6oPGZNSWUN5n3,,,,,40.71110535,-73.94689941,anonymous,EN,1,"Please recall a particular incident in which something happened and you were in complete control of the situation. Please describe the situation in which you felt in complete control‰ÛÓwhat happened, how you felt, etc. You can control how long you want to spend on this recall task.",,,,,,37,1,2,2,4,4,22,1,1,,1,DEATH RARC,2,4376733
12/5/17 13:11,12/5/17 13:13,0,73.156.34.188,100,128,1,12/5/17 13:13,R_3CBgOH4kW3COCDf,,,,,26.39970398,-81.70110321,anonymous,EN,1,a time when I felt in control of something was on my wedding day. I felt like I had the entire event planned in advance and I felt like I could control how the event would play out based on my planning.,,,,,,22,2,2,2,2,4,52,2,1,,2,,,7207818
12/5/17 13:14,12/5/17 13:16,0,207.144.4.101,100,110,1,12/5/17 13:16,R_2Ys3HCiuRM2oggN,,,,,32.4355011,-83.72669983,anonymous,EN,1,I had to plan a party for a family member. I had to organize what everyone brung and where the party would be located. It was my job to ensure everyone had a great time. ,,,,,,2,5,4,3,5,5,34,2,1,,2,,,7938116
12/5/17 13:13,12/5/17 13:16,0,67.1.154.1,100,190,1,12/5/17 13:16,R_1jDGlhCBq7Io3YQ,,,,,32.22169495,-110.9264984,anonymous,EN,1,,0.911,0.911,90.007,1,"I was at a arizona football game a week ago and I was watching the football game, I wanted arizona to win the game very much, but they were down about 14 points and their wasn't much of a chance for them to come back, I was getting upset, and frusturated their is nothing I can do to effect the outcome of the game, but I watched it till the end, and they lost but I was prepared by the end of the game that ",28,4,5,4,5,4,25,1,1,,1,Vicodin ,1,5730581
12/5/17 13:16,12/5/17 13:19,0,108.185.234.87,100,185,1,12/5/17 13:19,R_1OYM1L7gtpvhina,,,,,34.40649414,-118.4015045,anonymous,EN,1,,24.165,24.356,90.008,2,"We filed our tax return electronically last year. Refund was supposed to come quickly - but nothing for 3 weeks. we called the IRS. called and talked to about six people, shunted around, nobody knew what was going on. finally some bean counter discovered our tax refund had been flagged for possible identity theft and transferred to another department for review. Review would take 45 days. no exceptions. no matter what we did or said, our tax return was locked in the grubby paws of the government until it decided it had used up sufficient red tape to give us what we were due. we felt totally powerless, and  mad, and frustrated.",9,2,3,4,3,4,58,2,2,,1,"Imitrex, Ultracet, Aleve",3,2177016
12/5/17 13:14,12/5/17 13:19,0,67.140.45.171,100,325,1,12/5/17 13:19,R_22Kr9jDWx1yAGqv,,,,,32.66119385,-83.78540039,anonymous,EN,1,,30.992,30.992,90.022,1,One time when I was at work and I was with the manager I felt like I had no power. It's never a good feeling but I cou,47,3,4,4,3,5,22,1,1,,2,,,8422074
12/5/17 13:17,12/5/17 13:19,0,71.45.113.50,100,135,1,12/5/17 13:19,R_24CTGjiCWOFxT5L,,,,,33.52250671,-86.76830292,anonymous,EN,1,,5.022,85.177,90.007,2,"My aunt died of cancer, and I wish I could have helped her but it was out of my control. I was very sad. I tried to spend time with her in her last few days.",1,4,4,4,4,4,32,1,2,,2,,,5751440
12/5/17 13:11,12/5/17 13:22,0,73.153.45.51,100,664,1,12/5/17 13:22,R_2BznyaIfELEhbCG,,,,,40.39959717,-104.8002014,anonymous,EN,1,,4.019,487.509,542.841,4,I was once laid of from my job due to outsourcing. I went in for work like normal only to have the whole staff called into a meeting,33,2,2,2,2,3,33,1,2,,2,,,1417381
12/5/17 13:19,12/5/17 13:22,0,69.181.223.187,100,178,1,12/5/17 13:22,R_2y7L3TyOUPHIT8A,,,,,37.78109741,-122.4625015,anonymous,EN,1,"Today, i'm in control of how much effort I want to put in today. I get to choose if I want to work for part of the day, all of the day, or none of the day. Its completely up to me how much I want to do.I feel that I have complete autonomy to do what I want. It feels good to have that type of freedom.",,,,,,10,5,4,4,4,4,39,1,2,,2,,,8840435
12/5/17 13:23,12/5/17 13:26,0,47.155.93.33,100,173,1,12/5/17 13:26,R_2Vs7uXOuh8n9zq3,,,,,33.9329071,-118.0088959,anonymous,EN,1,I was in complete control of the situation when I was at work and having a conversation with a patron. The patron wanted a refund for a non-refundable transaction. I was only able to offer an exchange due to our policy. I felt supported by our policy and by my knowledge in it. The patron excepted that I could not waiver and a resolution was reached.,,,,,,0,4,5,4,4,4,28,2,1,,2,,,3091778
12/5/17 13:25,12/5/17 13:27,0,70.173.13.225,100,124,1,12/5/17 13:27,R_xgeBB9fsTqi4ESJ,,,,,36.17869568,-115.3152008,anonymous,EN,1,,1.045,58.812,90.032,4,I once was rear ended by someone at an intersection.  I was completely stopped and had no control over being hit.  I wasn't hurt but I did suffer some fender damage.  ,10,5,5,5,5,5,33,1,2,,2,,,3630096
12/5/17 13:26,12/5/17 13:29,0,97.125.115.24,100,156,1,12/5/17 13:29,R_22CWRRFtnBYVIhn,,,,,43.71629333,-123.0373993,anonymous,EN,1,,5.684,5.684,90.01,1,we never have control. its dangerous to pretend that we can ever have control. like when the bus arrived layr yoday. no one person impacted that. like the fog todau s,8,4,2,4,2,4,54,2,1,,2,,,2257325
12/5/17 13:27,12/5/17 13:30,0,96.86.30.97,100,157,1,12/5/17 13:30,R_3P7CXSAOyCHXALZ,,,,,38.90570068,-76.978302,anonymous,EN,1,,8.191,69.897,90.01,4,"I was physically assaulted by a family member. I was knocked unconscious and when I attempted to run away, I jumped out of a window and severed my arm very badly from a metal window box.  I did not see it coming and did not have control over ",92,2,4,4,4,4,59,2,1,,1,Tylenol,4,3157866
12/5/17 13:27,12/5/17 13:32,0,207.55.51.61,100,296,1,12/5/17 13:32,R_3HZI5V8xmFnRg3c,,,,,44.80070496,-122.7944946,anonymous,EN,1,I felt like I was in control when I made the decision to take my son out of school and home school him. It was the best thing I could have done for him and he has done so much better,,,,,,40,2,4,3,5,5,33,2,7,,2,,,1480927
12/5/17 13:29,12/5/17 13:32,0,24.184.254.97,100,199,1,12/5/17 13:32,R_2cq4yukb4UQCmbs,,,,,40.59609985,-73.97319794,anonymous,EN,1,,0.74,0.74,90.01,1,"The last time I had no control over a situation was when I had applied for a job and I did not get the job. I felt very depressed and upset because I had worked hard for the position and I did not get it. I was very motivated while applying for the position and when i heard the bad news,",81,2,2,4,5,5,34,1,1,,2,,,1638223
12/5/17 13:29,12/5/17 13:33,0,76.21.71.205,100,203,1,12/5/17 13:33,R_siq9iy07TjdRFbb,,,,,37.3421936,-121.8833008,anonymous,EN,1,"I forgot to iron my husband shirt for work and we were about to late in the morning, so while he was preparing the kid for daycare I tried to iron a shirt as soon as possible for 3-4 minutes and we did not late. As was completely in control because I am very quick with this activity.",,,,,,38,5,5,5,4,5,44,2,1,,2,,,9732995
12/5/17 13:30,12/5/17 13:33,0,96.57.65.98,100,169,1,12/5/17 13:33,R_2rhVSzZnDwz2eIR,,,,,40.87780762,-73.00450134,anonymous,EN,1,,14.666,14.666,90.005,1,"I was actually leaving work ( my warehouse ) when my superior called and told me he is coming and to wait for him.He came to my office with HR rep... yup... I was ""let go"". They told me that this is my last day at work and they ",1,4,2,4,4,4,36,1,1,,2,,,5819827
12/5/17 13:31,12/5/17 13:33,0,173.209.69.250,100,135,1,12/5/17 13:33,R_2sScbmfvsmQqVL7,,,,,26.18840027,-97.92320251,anonymous,EN,1,I was promoted to manager of a store. I had the qualifications and did not experience any problems stepping up to the role.,,,,,,35,3,2,4,4,5,58,1,2,,1,"tramadol, gabapentin",1,4516963
