StartDate,EndDate,Status,IPAddress,Progress,Duration (in seconds),Finished,RecordedDate,ResponseId,RecipientLastName,RecipientFirstName,RecipientEmail,ExternalReference,LocationLatitude,LocationLongitude,DistributionChannel,UserLanguage,consent,high_control,Q3.1_First Click,Q3.1_Last Click,Q3.1_Page Submit,Q3.1_Click Count,low_control,pain_rate_1,control_1,control_2,control_3,control_4,control_5,age,gender,employment,employment_7_TEXT,painkiller,painkiller_type,painkiller_freq,mTurkCode
12/5/17 13:27,12/5/17 13:34,0,98.18.21.84,100,380,1,12/5/17 13:34,R_3qNIfWSf5BEor1J,,,,,29.83230591,-82.58540344,anonymous,EN,1,"I was recently offered a job to write couponing blogs for a man who owns a popular restaurant app here in town. After much deliberation I ended up turning him down due to time constraints and the work that was involved for the pay. I felt pressured, but completely in control of the decision. It felt great to tell him no!",,,,,,60,4,4,4,5,5,43,2,7,I have a health condition keeping me from working in my field,1,Loradin. (Claritain for chronic ear pain.) I also take advil occasionally for headaches.,3,6016163
12/5/17 13:31,12/5/17 13:35,0,76.177.89.72,100,212,1,12/5/17 13:35,R_25LYRYKXrjWngsg,,,,,38.06350708,-83.93630219,anonymous,EN,1,"I made the choice just a few minutes ago to get out of bed, back to my desk, and start working, even though I feel like I've been trampled by a herd of wildebeests. I chose not to let my disabilities keep me from working any longer today; I'd spent the morning and half the afternoon dozing in bed, in pain from a change in the weather.",,,,,,75,5,1,1,1,3,39,2,2,,1,"ibuprofen, mobic, gabapentin",1,1917468
12/5/17 13:34,12/5/17 13:39,0,67.140.45.171,100,243,1,12/5/17 13:39,R_306pvjbrDKjnco1,,,,,32.66119385,-83.78540039,anonymous,EN,1,,0.162,79.785,90.012,3,Being in no power can make you feel bad like it made me when I was with my friend and he got moved up to a better position within our company and it made me feel like I was below him with nobody really caring about what I could bring to the table. ,46,3,3,1,5,2,22,1,1,,2,,,9414185
12/5/17 13:39,12/5/17 13:40,0,71.218.70.171,100,48,1,12/5/17 13:40,R_2uKH1VIbOcSlAIS,,,,,39.86630249,-105.0061035,anonymous,EN,1,"I was at the venue. The manager called saying he's running late. He had me direct the show until he showed up. I told people when they were going on, and collected the tickets & money. I think I did a really good job.",,,,,,53,3,3,4,3,4,31,1,1,,2,,,5106426
12/5/17 13:28,12/5/17 13:44,0,75.102.129.227,100,960,1,12/5/17 13:44,R_eIM8qtgHSi0efEB,,,,,28.58869934,-81.18930054,anonymous,EN,1," A few week s ago i was in my brother in law car.We were heading to a mall near by to help him chose a gift for his wife.While he was driving another car came from no were and hit us on the driver side.The car was damaged a little, we were ok, but my brother in law got very angry. He started yelling at the other driver and jump to punch him.I had to hold him not to punch the other guy and i tried to call him down.Cops came and all was fine in the end.I think that i was good thing i was there to control the situation and to stop my brother in law to get into a fight.",,,,,,40,3,4,4,5,4,38,1,1,,1,advil,4,9457217
12/5/17 13:42,12/5/17 13:45,0,107.195.14.24,100,143,1,12/5/17 13:45,R_eXunSyl7sOOx8Rj,,,,,34.14830017,-84.14040375,anonymous,EN,1,,1.115,1.115,90.009,1,One time as a kid I was riding with my dad to the store. We were on the interstate when suddenly we crashed. I was scared. I felt confused. I didn't know what happened. My dad had crossed lanes without looking and hit an upcoming vehicle going,0,5,5,5,4,4,29,1,1,,2,,,4537602
12/5/17 13:50,12/5/17 13:52,0,73.250.231.220,100,120,1,12/5/17 13:52,R_1g7J5iZv4nqiDfQ,,,,,39.27839661,-76.55699921,anonymous,EN,1,,0.567,71.399,91.401,4,Recently something happened that I had no control over. I was at work and was going for a performance review. My boss had complete control over my review. This made me feel like I had no control and was powerless.,0,5,5,5,5,5,30,1,1,,2,,,7179954
12/5/17 13:51,12/5/17 13:57,0,66.75.18.69,100,347,1,12/5/17 13:57,R_2Y2M9taNaoQoqvQ,,,,,34.97009277,-116.9929047,anonymous,EN,1,"When I worked, I had complete control of how I wanted to spend my time at work. (this response prompt is funny because you can't control how long you want to spend on it because it needs to be at least 100 characters long--talk about the lack of control here).",,,,,,0,4,4,5,5,4,27,2,8,,2,,,7681256
12/5/17 14:00,12/5/17 14:03,0,97.34.104.152,100,176,1,12/5/17 14:03,R_2E04BscLMMyFo6U,,,,,37.75100708,-97.8219986,anonymous,EN,1,,2.993,53.765,90.027,9,When I lost both my parents last year to cancer 9 weeks apart I had no control at all over the situation.,0,5,5,5,5,5,25,2,1,,1,Ibuprofen,3,710866
12/5/17 14:26,12/5/17 14:27,0,69.141.36.252,100,59,1,12/5/17 14:27,R_W6uJMIjKZsGQuBP,,,,,39.62469482,-74.20420074,anonymous,EN,1,I felt in control when I was at work and I had to give my team permission to work on the certain project,,,,,,62,2,3,3,4,4,29,1,1,,1,Perks,2,8194973
12/5/17 14:25,12/5/17 14:30,0,73.31.59.110,100,330,1,12/5/17 14:30,R_2axd0AjyHcAKQJH,,,,,37.29420471,-81.18319702,anonymous,EN,1,,5.449,9.628,90.028,3,My old man died of cancer. I watched him wither away to nothing. There was nothing I could do about it.,0,4,4,3,3,2,30,1,1,,2,,,5508595
12/5/17 14:17,12/5/17 14:35,0,173.225.146.199,100,1119,1,12/5/17 14:35,R_3NF0fzKArhCZcn6,,,,,45.75010681,-94.14009857,anonymous,EN,1,"About a month ago I was heading out in my 1993 Chevrolet to bring an eBay package to the post office when the brakes suddenly went to the floor. Now I am somewhat of a mechanic going way back but brakes frightened me as to how hard the repair would be for a home handyman as they are hydraulic and must be done a certain way. But I studied the internet for that car and some forums and went to Auto Zone and got the one hose I needed (only to learn they gave me the wrong part) and with the car torn down I had to take it off jacks and then back to the store ugg. I got the right part, easily learned how to bleed them (drivers side rear tire only) and fixed the whole thing for about $20 ($10 of that was gas getting the part (twice). I persevered, succeeded and learned. Works great now.",,,,,,30,5,4,5,5,5,60,1,2,,1,I had a tooth extracted yesterday and am on 600mg prescribed Ibuprofen. Normally I also have a bad ankle and some pain with that sometimes but am not normally on pain meds except here and there I take some ibuprofen or aspirin.,4,7074337